ID ORGAO	SIGLA	id Serv.	NomeServico	Categoria	NomeServico*: 	NomesPopulares: 	DescricaoServico*: 	Gratuidade	UnidadeAtendim*: 	Tempo: 	Outras Informacoes: 	Solicitante*: 	Categoria*: 	Publico Alvo*: 	Titulo Etapa*: 	Descricao Etapa*: 	Custo Etapa: 	Canais de Prestacao: 	Documentos: 	Comentarios Tempo: 	Comentarios Custo: 	Excecoes de Documentos: 	Campos Obrigatorios 8 totais:	Campos Opcionais 8 totais: 	COMPLETUDE 16 totais:
5908eaf78c36c7723803da8f	SEDUC	5945cd798c36c73b028c3b78	Pesquisa das Unidades Escolares da rede estadual	Educação	1	1	1	False	1	1	0	1	1	1	1	1	1	1	0	1	1	1	8	6	14
5750117e8c36c718eb000005	SEFAZ	5786692c8c36c77bdc000002	Emissão de DAR - Documento de Arrecadação	Documentos	1	1	1	False	1	1	1	1	1	1	1	1	1	1	1	0	0	0	8	6	14
5750117e8c36c718eb000005	SEFAZ	57866c818c36c77dc1000000	Nota Fiscal Cidadã	Documentos	1	1	1		1	1	1	1	1	1	1	1	1	1	1	0	0	0	8	6	14
5750117e8c36c718eb000005	SEFAZ	5786724d8c36c77fe6000001	Parcelamento de IPVA	Economia e Finanças	1	1	1	True	1	1	1	1	1	1	1	1	1	1	1	0	0	0	8	6	14
5750117e8c36c718eb000005	SEFAZ	5788d0a38c36c76a73000000	Protocolo de processos	Documentos	1	1	1	True	1	1	1	1	1	1	1	1	1	1	1	1	1	1	8	8	16
5750117e8c36c718eb000005	SEFAZ	5788d67b8c36c76d1e000000	Relatórios fiscais	Documentos	1	1	1	True	1	1	1	1	1	1	1	1	1	1	1	0	0	0	8	6	14
5750117e8c36c718eb000005	SEFAZ	57b5d6f48c36c744de000000	Certidão Negativa de Débitos	Documentos	1	1	1	True	1	1	1	1	1	1	1	1	1	1	0	1	1	1	8	7	15
5750117e8c36c718eb000005	SEFAZ	57b5d8568c36c744de000001	Taxa de Bombeiro	Segurança e Ordem Pública	1	1	1	False	1	1	1	0	1	1	0	0	1	0	0	0	0	0	5	4	9
5750117e8c36c718eb000005	SEFAZ	588f8fdf8c36c760c661af9a	Importação com Exoneração do ICMS	Economia e Finanças	1	0	0	True	1	1	0	1	1	1	1	1	1	0	1	0	0	0	7	3	10
5750117e8c36c718eb000005	SEFAZ	588f92f48c36c760c661af9b	Solicitação de  Baixa de Inscrição Estadual	Economia e Finanças	1	0	1	True	1	1	0	1	1	1	1	1	1	0	0	1	1	1	8	4	12
5750117e8c36c718eb000005	SEFAZ	588f94798c36c76a11df73c3	Importação com Liquidação do ICMS em Espécie	Economia e Finanças	1	0	1	True	1	1	1	1	1	1	1	1	1	1	1	1	1	1	8	7	15
5750117e8c36c718eb000005	SEFAZ	588f968c8c36c76a11df73c4	Importação com Deferimento do ICMS sem Recolhimento em Espécie	Economia e Finanças	1	0	1	True	1	1	0	1	1	1	1	1	1	0	1	0	0	0	8	3	11
5750117e8c36c718eb000005	SEFAZ	588f97f08c36c76a11df73c5	Ato Concessivo de Autorização	Economia e Finanças	1	0	1	True	1	1	0	1	1	1	1	1	1	0	1	1	1	1	8	5	13
5750117e8c36c718eb000005	SEFAZ	588f991d8c36c76a11df73c6	Importação Temporária	Economia e Finanças	1	0	1	True	1	1	0	1	1	1	1	1	1	0	1	1	1	1	8	5	13
5750117e8c36c718eb000005	SEFAZ	588f99e68c36c76a11df73c7	Importação Drawback	Economia e Finanças	1	0	1	True	1	1	0	1	1	1	1	1	1	0	1	1	1	1	8	5	13
5750117e8c36c718eb000005	SEFAZ	588f9b148c36c76a11df73c8	Exportação	Economia e Finanças	1	0	1	False	1	1	0	1	1	1	0	0	1	0	0	1	1	1	6	4	10
5750117e8c36c718eb000005	SEFAZ	588f9c4a8c36c76a11df73c9	Implantação de Créditos de Precatórios oriundos de Certificação de Servidores	Economia e Finanças	1	0	1	True	1	1	0	1	1	1	1	1	1	0	1	1	1	1	8	5	13
5750117e8c36c718eb000005	SEFAZ	588f9d4b8c36c76a11df73ca	Abertura de Conta Gráfica	Economia e Finanças	1	0	1	True	1	1	0	1	1	1	1	0	1	0	0	1	1	1	7	4	11
5750117e8c36c718eb000005	SEFAZ	588f9e288c36c77709ab0290	Transferência de Créditos de Contas Gráficas	Economia e Finanças	1	0	1	True	1	1	0	1	1	1	1	1	1	0	0	1	1	1	8	4	12
5750117e8c36c718eb000005	SEFAZ	588fa4978c36c77709ab0297	Esclarecimentos Sobre Irregularidades do Imposto Estadual	Economia e Finanças	1	0	1	False	1	1	0	1	1	1	1	1	1	0	1	1	1	1	8	5	13
5750117e8c36c718eb000005	SEFAZ	588fa5df8c36c77709ab0299	Localização de pagamentos não identificados	Economia e Finanças	1	0	1	False	1	1	0	1	1	1	1	1	1	0	1	1	1	1	8	5	13
5750117e8c36c718eb000005	SEFAZ	588fa6b38c36c77709ab029b	Direcionamento de parcelas de IPVA pagas em duplicidade	Economia e Finanças	1	0	1	False	1	1	0	1	1	1	1	1	1	0	1	1	1	1	8	5	13
5750117e8c36c718eb000005	SEFAZ	588fa7cd8c36c77709ab029c	Informações gerais sobre parcelamento do ICMS	Economia e Finanças	1	0	1	False	1	1	0	1	1	1	1	1	1	0	0	1	1	1	8	4	12
5750117e8c36c718eb000005	SEFAZ	588fac5c8c36c77709ab029d	Atendimento ao contribuinte para vistas aos autos dos processos de Autos de Infração notificados	Economia e Finanças	1	0	1	False	1	1	0	1	1	1	1	1	1	0	1	1	1	1	8	5	13
5750117e8c36c718eb000005	SEFAZ	588fadd18c36c77709ab029e	Concessão de cópia de processos	Economia e Finanças	1	0	1	True	1	1	0	1	1	1	1	1	1	0	1	1	1	1	8	5	13
5750117e8c36c718eb000005	SEFAZ	588fae9a8c36c77709ab029f	Dúvidas relacionadas à legislação tributária estadual	Economia e Finanças	1	0	1		1	1	0	1	1	1	1	1	1	0	0	1	1	1	8	4	12
5750117e8c36c718eb000005	SEFAZ	588fb01a8c36c77709ab02a0	Disponibilização legislação tributária estadual	Economia e Finanças	1	0	1	False	1	1	0	1	1	1	1	1	1	0	0	1	1	1	8	4	12
5750117e8c36c718eb000005	SEFAZ	588fb1268c36c77709ab02a1	Call Center	Economia e Finanças	1	0	1	False	1	1	0	1	1	1	1	1	1	1	0	1	1	1	8	5	13
5750117e8c36c718eb000005	SEFAZ	588fb3ca8c36c7104ecd05f5	Balcão de Atendimento	Economia e Finanças	1	0	1	False	1	1	0	1	1	1	1	1	1	0	1	1	1	1	8	5	13
5750117e8c36c718eb000005	SEFAZ	588fb5538c36c7167565e3d6	Emissão de dar-documento de arrecadação do simples nacional	Economia e Finanças	1	1	1	False	1	1	0	1	1	1	1	1	1	0	1	1	1	1	8	6	14
5750117e8c36c718eb000005	SEFAZ	588fb6218c36c7167565e3d7	Impugnação ao Termo de Indeferimento de Opção	Economia e Finanças	1	0	1	False	1	1	0	1	1	1	1	1	1	0	1	1	1	1	8	5	13
5750117e8c36c718eb000005	SEFAZ	588fb7708c36c7239917ff52	Impugnação ao Termo de Exclusão do Simples Nacional	Economia e Finanças	1	0	1	False	1	1	0	1	1	1	1	1	1	0	1	1	1	1	8	5	13
5750117e8c36c718eb000005	SEFAZ	588fb8f48c36c7239917ff53	Impugnação ao Termo de Desenquadramento do MEI	Economia e Finanças	1	0	1	False	1	1	0	1	1	1	1	1	1	0	1	1	1	1	8	5	13
5750117e8c36c718eb000005	SEFAZ	588fb9a68c36c7239917ff54	Impugnação do Registro de Exclusão no Portal do Simples Nacional	Economia e Finanças	1	0	1	False	1	1	0	1	1	1	1	1	1	0	1	1	1	1	8	5	13
5750117e8c36c718eb000005	SEFAZ	588fba6f8c36c7239917ff55	Requerimento de Justificativa de regularização de pendências	Economia e Finanças	1	0	1	False	1	1	0	1	1	1	1	1	1	0	0	1	1	1	8	4	12
5750117e8c36c718eb000005	SEFAZ	588fbb698c36c7239917ff56	Termo de Confissão de dívida da Receita Tributada Omitida	Economia e Finanças	1	1	1	False	1	1	0	1	1	1	1	1	1	0	0	1	1	1	8	5	13
5750117e8c36c718eb000005	SEFAZ	588fbbe08c36c7239917ff57	Declaração do Resumo do Livro Caixa	Economia e Finanças	1	0	1	False	1	1	0	1	1	1	1	1	1	0	0	1	1	1	8	4	12
5750117e8c36c718eb000005	SEFAZ	588fbd308c36c72c230688ac	Relatório Mensal de Receitas Brutas do MEI	Economia e Finanças	1	0	1	False	1	1	0	1	1	1	1	1	1	0	0	1	1	1	8	4	12
5750117e8c36c718eb000005	SEFAZ	588fbe1e8c36c72c230688ad	Registro de Valores a Receber	Economia e Finanças	1	0	1	False	1	1	0	1	1	1	1	1	1	0	0	1	1	1	8	4	12
5750117e8c36c718eb000005	SEFAZ	588fbe988c36c72c230688ae	Perguntas e respostas	Economia e Finanças	1	0	1	False	1	1	0	1	1	1	1	1	1	0	0	1	1	1	8	4	12
5750117e8c36c718eb000005	SEFAZ	588fc0358c36c72c230688af	Atendimento Virtual Transportadora RLA	Economia e Finanças	1	0	1	False	1	1	0	1	1	1	1	1	1	1	1	1	1	1	8	6	14
5750117e8c36c718eb000005	SEFAZ	588fc17d8c36c72c230688b0	Nota Fiscal Eletrônica - NF-e - Habilitação	Economia e Finanças	1	0	1	False	1	1	0	1	1	1	1	1	1	0	1	1	1	1	8	5	13
5750117e8c36c718eb000005	SEFAZ	588fc2358c36c72c230688b1	Nota Fiscal Eletrônica - NF-e - Suporte Técnico	Economia e Finanças	1	0	1	False	1	1	0	1	1	1	1	1	1	0	1	1	1	1	8	5	13
5750117e8c36c718eb000005	SEFAZ	588fc2d28c36c72c230688b2	Suporte Técnico da Nota Fiscal Avulsa Eletrônica - NFA-e	Economia e Finanças	1	0	1	False	1	1	0	1	1	1	1	1	1	0	1	1	1	1	8	5	13
5750117e8c36c718eb000005	SEFAZ	5890c34c8c36c72dca7569ed	Nota Fiscal do Consumidor Eletrônica - NFC-e	Economia e Finanças	1	0	1	True	1	1	1	1	1	1	1	1	1	0	0	1	1	1	8	5	13
5750117e8c36c718eb000005	SEFAZ	5890c3a28c36c72dca7569ee	Conhecimento de Transporte Eletrônico - CT-e	Economia e Finanças	1	1	1	False	1	1	0	1	1	1	1	1	1	0	0	1	1	1	8	5	13
5750117e8c36c718eb000005	SEFAZ	5890c3f48c36c72dca7569ef	Manifesto de Documentos Fiscais Eletrônicos - MDF-e	Economia e Finanças	1	1	1	False	1	1	0	1	1	1	1	1	1	0	0	1	1	1	8	5	13
5750117e8c36c718eb000005	SEFAZ	5890c4988c36c72dca7569f0	Adesão Voluntária ao SPED - ICMS/IPI	Economia e Finanças	1	0	1	True	1	1	0	1	1	1	1	1	1	0	1	1	1	1	8	5	13
5750117e8c36c718eb000005	SEFAZ	5890c4d98c36c72dca7569f1	SPED - ICMS/IPI - Suporte Técnico	Economia e Finanças	1	0	1	False	1	1	0	1	1	1	1	1	1	0	0	1	1	1	8	4	12
5750117e8c36c718eb000005	SEFAZ	5890c53e8c36c72dca7569f2	DeSTDA - Suporte Técnico	Economia e Finanças	1	0	1		1	1	0	1	1	1	1	1	1	0	0	1	1	1	8	4	12
5750117e8c36c718eb000005	SEFAZ	5890c6108c36c72dca7569f3	Inscrição Estadual da Emenda Constitucional Nº 87/2015	Economia e Finanças	1	1	1	True	1	1	0	1	1	1	1	1	1	0	1	1	1	1	8	6	14
5750117e8c36c718eb000005	SEFAZ	5890c6f98c36c72dca7569f4	Solicitação de  Inscrição Estadual quando alterar atividade  de interesse do Estado	Economia e Finanças	1	0	1	True	1	1	0	1	1	1	1	1	1	0	1	1	1	1	8	5	13
5750117e8c36c718eb000005	SEFAZ	5890c7ae8c36c72dca7569f5	Reativação de  Inscrição Estadual	Economia e Finanças	1	0	1	True	1	1	0	1	1	1	1	1	1	0	1	1	1	1	8	5	13
5750117e8c36c718eb000005	SEFAZ	589204608c36c70c1080ae71	Serviço de Informação ao Cidadão	Economia e Finanças	1	0	1	False	1	1	1	1	1	1	1	0	1	1	0	0	0	0	7	4	11
5908e8138c36c7723803da8e	SEMUDH	593850368c36c70f36240605	Atendimento à mulher em situação de violência em Alagoas	Direitos Humanos	1	0	1	False	1	1	0	1	1	1	1	1	1	1	0	0	0	0	8	3	11
5908e8138c36c7723803da8e	SEMUDH	593851388c36c70f36240607	Atendimento interpretativo às pessoas com deficiência.	Direitos Humanos	1	0	1	False	1	1	0	1	1	1	1	1	1	1	0	0	0	0	8	3	11
5908e8138c36c7723803da8e	SEMUDH	5938523f8c36c70f36240609	Doação e aquisição de OPM	Direitos Humanos	1	0	1	False	1	1	0	1	1	1	1	1	1	1	0	0	0	0	8	3	11
5908e8138c36c7723803da8e	SEMUDH	593852f68c36c70f3624060b	Fiscalização do cumprimento da legislação que assegura as pessoas com deficiência.	Direitos Humanos	1	0	1	False	1	1	0	1	1	1	1	1	1	1	0	0	0	0	8	3	11
5908e8138c36c7723803da8e	SEMUDH	593853858c36c70f3624060d	Atendimento ao consumidor	Comércio e Serviços	1	0	1	False	1	1	0	1	1	1	1	1	1	1	0	0	0	0	8	3	11
596e4d008c36c70a18c2cc92	SESAU	59aee7c28c36c76afbdf5a33	Serviço Médico de Emergência	Saúde	1	1	1	False	1	1	0	1	1	1	1	1	1	0	1	1	1	1	8	6	14
596e4d008c36c70a18c2cc92	SESAU	59aee99d8c36c76afbdf5a35	Serviço de  Emergência em Pediatria	Saúde	1	1	1	False	1	1	0	1	1	1	1	1	1	1	1	1	1	1	8	7	15
596e4d008c36c70a18c2cc92	SESAU	59aeeb128c36c76afbdf5a37	Serviço de Ortopedia e Traumatologia	Saúde	1	1	1	False	1	1	0	1	1	1	1	1	1	0	1	1	1	1	8	6	14
596e4d008c36c70a18c2cc92	SESAU	59aeec6f8c36c76afbdf5a39	Serviço de Atendimento ao AVC	Saúde	1	1	1	False	1	1	0	1	1	1	1	1	1	1	1	1	1	1	8	7	15
596e4d008c36c70a18c2cc92	SESAU	59aeedce8c36c76afbdf5a3b	Serviço de Atendimento Cardiológico	Saúde	1	1	1	False	1	1	0	1	1	1	1	1	1	1	1	0	0	0	8	5	13
596e4d008c36c70a18c2cc92	SESAU	59aeef2b8c36c76afbdf5a3d	Serviço de Atendimento aos Queimados	Saúde	1	1	1	False	1	1	0	1	1	1	1	1	1	1	1	1	1	1	8	7	15
596e4d008c36c70a18c2cc92	SESAU	59c531fc8c36c70694747eef	Urgência Pediatrica	Saúde	1	0	1	False	1	1	0	1	1	1	1	1	1	0	0	1	1	1	8	4	12
596e4d008c36c70a18c2cc92	SESAU	59c53c028c36c70694747ef1	Atendimento/Internação em Urgência Cirurgica	Saúde	1	0	1	False	1	1	0	1	1	1	1	1	1	1	1	1	1	1	8	6	14
596e4d008c36c70a18c2cc92	SESAU	59c53d018c36c70694747ef3	Cirurgia Eletiva	Saúde	1	1	1	False	1	1	0	1	1	1	1	1	1	1	1	1	1	1	8	7	15
596e4d008c36c70a18c2cc92	SESAU	59c549a68c36c70694747ef7	Atendimento em Obstetrícia Hospitalar	Saúde	1	1	1	False	1	1	0	1	1	1	1	1	1	1	1	1	1	1	8	7	15
596e4d008c36c70a18c2cc92	SESAU	59c54e628c36c70694747efa	Atendimento Urgência Clínica	Saúde	1	0	1	False	1	1	0	1	1	1	1	1	1	1	1	1	1	1	8	6	14
596e4d008c36c70a18c2cc92	SESAU	59c551b88c36c7461539f989	Serviço de Urgência odontológica 24 horas	Saúde	1	1	1	False	1	1	0	1	1	1	1	1	1	1	1	1	1	1	8	7	15
596e4d008c36c70a18c2cc92	SESAU	59c5597b8c36c7461539f98c	SAMU -Serviço de Atendimento Móvel de Urgência/ Sesau	Saúde	1	0	1	False	1	1	0	1	1	1	1	1	1	1	0	1	1	1	8	5	13
596e4d008c36c70a18c2cc92	SESAU	59c5c41d8c36c70a7b1c9559	Serviço de Atendimento ao Cidadão	Saúde	1	0	1	False	1	1	1	1	1	1	1	1	1	1	1	0	0	0	8	5	13
596e4d008c36c70a18c2cc92	SESAU	59c9116f8c36c75428f54b4c	Certidão de socorro	Saúde	1	0	1	False	1	1	0	1	1	1	1	1	1	1	1	0	0	0	8	4	12
596e4d008c36c70a18c2cc92	SESAU	59c913398c36c75428f54b4f	Ouvidoria SUS	Saúde	1	1	1	False	1	1	0	1	1	1	1	1	1	0	0	0	0	0	8	3	11
596e4d008c36c70a18c2cc92	SESAU	59c914b68c36c75428f54b52	Denúncias	Saúde	1	1	1	False	1	1	1	1	1	1	1	1	1	0	0	0	0	0	8	4	12
596e4d008c36c70a18c2cc92	SESAU	59c916558c36c75428f54b54	Inspeção Sanitária	Saúde	1	1	1	True	1	1	0	1	1	1	1	1	1	0	1	0	0	0	8	4	12
596e4d008c36c70a18c2cc92	SESAU	59c917d48c36c75428f54b56	Palestras	Saúde	1	1	1	False	1	1	0	1	1	1	1	1	1	0	1	1	1	1	8	6	14
596e4d008c36c70a18c2cc92	SESAU	59c918778c36c75428f54b58	Notificação de receituário azul, amarelo ou de talidomida.	Saúde	1	1	1	False	1	1	0	1	1	1	1	1	1	0	1	0	0	0	8	4	12
596e4d008c36c70a18c2cc92	SESAU	59c91aaa8c36c75428f54b5a	Doação de sangue	Saúde	1	0	1	False	1	1	0	1	1	1	1	1	1	0	1	0	0	0	8	3	11
596e4d008c36c70a18c2cc92	SESAU	59c91cc48c36c75428f54b5c	Cadastro de Doador Voluntário de Medula Óssea	Saúde	1	0	1	False	1	1	0	1	1	1	1	1	1	0	0	0	0	0	8	2	10
596e4d008c36c70a18c2cc92	SESAU	59c91e498c36c75428f54b5f	Projeto Educativo Doe Vida	Saúde	1	1	1	False	1	1	0	1	1	1	0	0	1	0	0	0	0	0	6	3	9
596e4d008c36c70a18c2cc92	SESAU	59c922fd8c36c75428f54b62	Coleta externa	Saúde	1	0	1	False	1	1	0	0	1	1	1	1	1	0	0	1	1	1	7	4	11
596e4d008c36c70a18c2cc92	SESAU	59c925118c36c75428f54b65	Ambulatório de Hematologia	Saúde	1	0	1	False	1	1	0	1	1	1	0	0	1	0	0	0	0	0	6	2	8
596e4d008c36c70a18c2cc92	SESAU	59c9260b8c36c75428f54b67	Plantão de Hematologia	Saúde	1	0	1	False	1	1	0	1	1	1	0	1	1	1	0	1	1	1	7	5	12
596e4d008c36c70a18c2cc92	SESAU	59c927c98c36c75428f54b69	Transfusão Ambulatorial	Saúde	1	0	1	False	1	1	0	1	1	1	0	1	1	1	0	0	0	0	7	3	10
596e4d008c36c70a18c2cc92	SESAU	59c93f4a8c36c75428f54b6d	Tratamento Fora de Domicilio	Saúde	1	0	1	False	1	1	0	1	1	1	1	1	1	1	1	1	1	1	8	6	14
596e4d008c36c70a18c2cc92	SESAU	59c940548c36c75428f54b6f	Regulação De Exames E Consultas	Saúde	1	0	1	False	1	1	0	1	1	1	1	1	1	0	1	0	0	0	8	3	11
596e4d008c36c70a18c2cc92	SESAU	59c941b18c36c75428f54b73	Internamentos de Média e Alta Complexidade	Saúde	1	0	1	False	1	1	0	1	1	1	1	1	1	1	1	0	0	0	8	4	12
596e4d008c36c70a18c2cc92	SESAU	59c942b48c36c75428f54b75	Captação de vagas fora do estado para procedimentos de alta complexidade em serviços nacionais fora do estado de alagoas	Saúde	1	0	1	False	1	1	0	1	1	1	1	1	1	0	1	0	0	0	8	3	11
596e4d008c36c70a18c2cc92	SESAU	59c9438d8c36c75428f54b77	Capacitação para técnicos municipais	Saúde	1	0	1	False	1	1	0	1	1	1	1	1	1	0	1	1	1	1	8	5	13
596e4d008c36c70a18c2cc92	SESAU	59c944788c36c75428f54b79	Transporte sanitário - SETS	Saúde	1	0	1	False	1	1	0	1	1	1	1	1	1	0	1	0	0	0	8	3	11
596e4d008c36c70a18c2cc92	SESAU	59c9b6018c36c743766ed0e0	Angioplastia Coronária ou Intervenção Coronária Percutânea	Saúde	1	0	1	False	1	1	0	1	1	1	1	1	1	0	1	0	0	0	8	3	11
596e4d008c36c70a18c2cc92	SESAU	59c9b78c8c36c743766ed0e2	Aquisição, Controle e Dispensação de Medicamentos E Manipulação de Nutrição Parenteral.	Saúde	1	0	1	False	1	1	0	0	1	1	0	0	1	0	0	1	1	1	5	4	9
596e4d008c36c70a18c2cc92	SESAU	59c9bb0b8c36c743766ed0e4	Arteriografia das Carótidas	Saúde	1	0	1	False	1	1	0	1	1	1	0	1	1	1	1	1	1	1	7	6	13
596e4d008c36c70a18c2cc92	SESAU	59c9bcdb8c36c743766ed0e6	Assistência Domiciliar aos Pacientes Internados	Saúde	1	0	1	False	1	1	0	1	1	1	0	1	1	1	1	1	1	1	7	6	13
596e4d008c36c70a18c2cc92	SESAU	59c9c45e8c36c743766ed0ec	Atendimento Ambulatorial de Enfermagem – Agendamento Cirúrgico	Saúde	1	0	1	False	1	1	0	1	1	1	0	1	1	1	1	1	1	1	7	6	13
596e4d008c36c70a18c2cc92	SESAU	59c9c60d8c36c743766ed0ee	Atendimento Ambulatorial nas Especialidades Médicas	Saúde	1	0	1	False	1	1	1	1	1	1	0	1	1	1	1	1	1	1	7	7	14
596e4d008c36c70a18c2cc92	SESAU	59c9c8d28c36c743766ed0f0	Atendimento às Demandas Sociais dos Usuários do HGE	Saúde	1	0	1	False	1	1	0	1	1	1	0	1	1	1	1	1	1	1	7	6	13
596e4d008c36c70a18c2cc92	SESAU	59c9cbf68c36c743766ed0f2	Atendimento de Fisioterapia aos Pacientes Internados no HGE	Saúde	1	0	1	False	1	1	0	1	1	1	0	1	1	1	1	1	1	1	7	6	13
596e4d008c36c70a18c2cc92	SESAU	59c9ce758c36c743766ed0f4	Atendimento Odontológico (Estética)	Saúde	1	0	1	False	1	1	0	1	1	1	0	1	1	1	1	1	1	1	7	6	13
596e4d008c36c70a18c2cc92	SESAU	59c9d36e8c36c743766ed0f6	Atendimento Psicológico para os Pacientes	Saúde	1	0	1	False	1	1	0	1	1	1	0	1	1	1	1	1	1	1	7	6	13
596e4d008c36c70a18c2cc92	SESAU	59c9d4aa8c36c743766ed0f8	Avaliação de Características Macroscópicas e Microscópicas em Alimentos	Saúde	1	0	1	False	1	1	0	1	1	1	0	1	1	1	0	1	1	1	7	5	12
596e4d008c36c70a18c2cc92	SESAU	59c9d6828c36c743766ed0fa	Baciloscopia para Tuberculose	Saúde	1	0	1	False	1	1	0	1	1	1	0	1	1	1	1	1	1	1	7	6	13
596e4d008c36c70a18c2cc92	SESAU	59c9da128c36c743766ed0fc	Broncoscopia	Saúde	1	0	1	False	1	1	0	1	1	1	0	1	1	1	1	1	1	1	7	6	13
596e4d008c36c70a18c2cc92	SESAU	59c9dbe08c36c743766ed0fe	Cateterismo Cardíaco	Saúde	1	0	1	False	1	1	0	1	1	1	0	1	1	1	1	0	0	0	7	4	11
596e4d008c36c70a18c2cc92	SESAU	59c9de3f8c36c743766ed100	Cirurgia Buco Maxilo-Facial	Saúde	1	0	1	False	1	1	0	1	1	1	0	1	1	1	1	1	1	1	7	6	13
596e4d008c36c70a18c2cc92	SESAU	59c9dfc98c36c743766ed102	Cirurgia vascular	Saúde	1	0	1	False	1	1	0	1	1	1	0	1	1	1	1	1	1	1	7	6	13
596e4d008c36c70a18c2cc92	SESAU	59c9e1db8c36c743766ed105	Coleta de Sangue para exames laboratoriais	Saúde	1	0	1	False	1	1	0	1	1	1	0	0	1	0	0	1	1	1	6	4	10
596e4d008c36c70a18c2cc92	SESAU	59ca68b08c36c734792345b4	Aposentadoria voluntária por tempo de contribuição e idade	Saúde	1	0	1	False	1	1	0	1	1	1	1	1	1	1	0	0	0	0	8	3	11
596e4d008c36c70a18c2cc92	SESAU	59ca69d38c36c734792345b6	Progressão funcional por Classe	Saúde	1	1	1	False	1	1	0	1	1	1	1	1	1	1	1	0	0	0	8	5	13
596e4d008c36c70a18c2cc92	SESAU	59ca6ab58c36c734792345b8	Licença por motivo de afastamento do cônjuge	Saúde	1	0	1	False	1	1	0	1	1	1	1	1	1	1	1	0	0	0	8	4	12
596e4d008c36c70a18c2cc92	SESAU	59ca6c188c36c734792345ba	Horário Especial de Trabalho	Saúde	1	0	1	False	1	1	0	1	1	1	1	1	1	1	1	0	0	0	8	4	12
596e4d008c36c70a18c2cc92	SESAU	59ca71f98c36c734792345bc	Exoneração	Saúde	1	0	1	False	1	1	0	1	1	1	1	1	1	1	1	0	0	0	8	4	12
596e4d008c36c70a18c2cc92	SESAU	59ca72688c36c734792345be	Licença para o Desempenho de Mandato Classista	Saúde	1	0	1	False	1	1	0	1	1	1	1	1	1	1	1	0	0	0	8	4	12
596e4d008c36c70a18c2cc92	SESAU	59ca75f98c36c734792345c0	Licença para Tratar de Interesses Particulares	Saúde	1	0	1	False	1	1	0	1	1	1	1	1	1	1	1	0	0	0	8	4	12
596e4d008c36c70a18c2cc92	SESAU	59ca76688c36c734792345c2	Averbação de Tempo de Serviço	Saúde	1	0	1	False	1	1	0	1	1	1	1	1	1	1	1	0	0	0	8	4	12
596e4d008c36c70a18c2cc92	SESAU	59ca79b28c36c734792345c4	Averbação de Licença Especial	Saúde	1	0	1	False	1	1	0	1	1	1	1	1	1	1	1	0	0	0	8	4	12
596e4d008c36c70a18c2cc92	SESAU	59ca7a618c36c734792345c6	Licença Prêmio por Assiduidade	Saúde	1	0	1	False	1	1	0	1	1	1	1	1	1	1	1	0	0	0	8	4	12
596e4d008c36c70a18c2cc92	SESAU	59cab5d28c36c76ef030479a	Central de notificação, captação e distribuição de órgãos estadual	Saúde	1	0	1	False	1	1	0	1	1	1	0	1	1	1	1	1	1	1	7	6	13
596e4d008c36c70a18c2cc92	SESAU	59cab9b08c36c76ef030479c	Dermatologia Geral	Saúde	1	0	1	False	1	1	0	1	1	1	1	1	1	1	0	1	1	1	8	5	13
596e4d008c36c70a18c2cc92	SESAU	59cabc498c36c76ef030479f	Detecção de Coliformes Totais e Fecais em Água para Consumo Humano	Saúde	1	0	1	False	1	1	1	0	1	1	0	0	1	0	0	1	1	1	5	5	10
596e4d008c36c70a18c2cc92	SESAU	59cabf4f8c36c76ef03047a1	Detecção de Microrganismos Aeróbios Mesofilos, em Alimentos	Saúde	1	0	1	False	1	1	0	0	1	1	0	1	1	1	1	1	1	1	6	6	12
596e4d008c36c70a18c2cc92	SESAU	59cacf5e8c36c707f413fcfe	Determinação da Turbidez da Água	Saúde	1	0	1	False	1	1	1	0	1	1	1	1	1	1	0	1	1	1	7	6	13
596e4d008c36c70a18c2cc92	SESAU	59cad5138c36c70d1f0247ef	ECG – Eletrocardiograma	Saúde	1	0	1	False	1	1	1	1	1	1	0	1	1	0	1	1	1	1	7	6	13
596e4d008c36c70a18c2cc92	SESAU	59cad7ab8c36c70d1f0247f1	ECO BI-Dimensional com Doppler	Saúde	1	0	1	False	1	1	0	0	1	1	1	1	1	1	1	1	1	1	7	6	13
596e4d008c36c70a18c2cc92	SESAU	59cb31308c36c73ed8a176ad	Dosagem de Ácido Úrico.	Saúde	1	0	1	False	1	1	0	0	1	1	0	1	1	1	1	1	1	1	6	6	12
596e4d008c36c70a18c2cc92	SESAU	59cb33088c36c73ed8a176af	Dosagem de Colesterol Hdl (Método Enzimático)	Saúde	1	0	1	False	1	1	0	1	1	1	0	1	1	1	1	1	1	1	7	6	13
596e4d008c36c70a18c2cc92	SESAU	59cb342c8c36c73ed8a176b1	Dosagem de Colesterol LDL.	Saúde	1	0	1	False	1	1	0	1	1	1	0	1	1	1	1	1	1	1	7	6	13
596e4d008c36c70a18c2cc92	SESAU	59cb35e28c36c73ed8a176b3	Dosagem de Colesterol Total	Saúde	1	0	1	False	1	1	0	1	1	1	0	1	1	1	1	1	1	1	7	6	13
596e4d008c36c70a18c2cc92	SESAU	59cb4b328c36c73ed8a176b5	Dosagem de Creatinina.	Saúde	1	0	1	False	1	1	0	1	1	1	0	1	1	1	1	1	1	1	7	6	13
596e4d008c36c70a18c2cc92	SESAU	59cbc2308c36c71c55721583	Exame de Endoscopia Digestiva	Saúde	1	0	1	False	1	1	0	1	1	1	0	1	1	1	1	1	1	1	7	6	13
596e4d008c36c70a18c2cc92	SESAU	59cbc5ff8c36c71c55721586	Exame de Radiologia	Saúde	1	0	1	False	1	1	0	1	1	1	0	1	1	1	1	1	1	1	7	6	13
596e4d008c36c70a18c2cc92	SESAU	59cbd2eb8c36c71c55721589	Exame de Tomografia com Contraste	Saúde	1	0	1	False	1	1	0	1	1	1	0	1	1	1	1	1	1	1	7	6	13
596e4d008c36c70a18c2cc92	SESAU	59cbd42a8c36c71c5572158b	Exame de Tomografia sem Contraste	Saúde	1	0	1	False	1	1	0	1	1	1	1	1	1	1	1	1	1	1	8	6	14
596e4d008c36c70a18c2cc92	SESAU	59cbd6368c36c71c5572158d	Exame de Transito Intestinal	Saúde	1	0	1	False	1	1	0	1	1	1	1	1	1	1	1	1	1	1	8	6	14
596e4d008c36c70a18c2cc92	SESAU	59cbd73e8c36c71c5572158f	Exame de Ultrassom Abdominal, Tórax, Aparelho, Urinário, Pélvico, Transfontanelar	Saúde	1	0	1	False	1	1	0	1	1	1	0	1	1	1	1	1	1	1	7	6	13
596e4d008c36c70a18c2cc92	SESAU	59cbdd118c36c71c55721591	Exame de Urodinâmica	Saúde	1	0	1	False	1	1	0	1	1	1	0	1	1	1	1	1	1	1	7	6	13
596e4d008c36c70a18c2cc92	SESAU	59cbe9668c36c71c557215a5	Exames Bioquímicos	Saúde	1	0	1	False	1	1	0	1	1	1	0	1	1	1	1	1	1	1	7	6	13
596e4d008c36c70a18c2cc92	SESAU	59cbeb098c36c71c557215a8	Exame de Urografia Escretora	Saúde	1	0	1	False	1	1	0	1	1	1	0	1	1	1	1	1	1	1	7	6	13
596e4d008c36c70a18c2cc92	SESAU	59cbf0148c36c71c557215aa	Holter	Saúde	1	0	1	False	1	1	0	1	1	1	0	1	1	1	1	1	1	1	7	6	13
596e4d008c36c70a18c2cc92	SESAU	59cbf1968c36c71c557215ac	Ultrassonografia Abdominal	Saúde	1	0	1	True	1	1	0	0	1	1	0	1	1	1	1	0	0	0	6	4	10
596e4d008c36c70a18c2cc92	SESAU	59cc200c8c36c71c557215af	Ultrassonografia (abdômen superior e inferior, cervical, renal, próstata, transvaginal, obstétrico e mama).	Saúde	1	0	1	False	1	1	0	1	1	1	0	1	1	1	1	1	1	1	7	6	13
596e4d008c36c70a18c2cc92	SESAU	59cc21ac8c36c71c557215b1	Unidade de AVC (Acidente Vascular Cerebral	Saúde	1	0	1	False	1	1	0	1	1	1	0	1	1	1	1	1	1	1	7	6	13
596e4d008c36c70a18c2cc92	SESAU	59cc22c18c36c71c557215b3	Vacinação de Crianças, Adolescentes, Adultos E Idosos	Saúde	1	0	1	False	1	1	1	1	1	1	0	1	1	1	1	1	1	1	7	7	14
596e4d008c36c70a18c2cc92	SESAU	59cc24338c36c71c557215b5	Vacinas de Rotina	Saúde	1	0	1	False	1	1	0	1	1	1	0	1	1	1	1	1	1	1	7	6	13
596e4d008c36c70a18c2cc92	SESAU	59cc24e48c36c71c557215b7	Vigilância Epidemiológica Hospitalar	Saúde	1	0	1	False	1	1	1	1	1	1	0	0	1	0	0	1	1	1	6	5	11
596e4d008c36c70a18c2cc92	SESAU	59cc26c68c36c71c557215ba	Ultrassonografia de Tireoide	Saúde	1	0	1	False	1	1	1	1	1	1	0	1	1	1	0	1	1	1	7	6	13
596e4d008c36c70a18c2cc92	SESAU	59cc494d8c36c773a84e2f7a	Vigilância Epidemiológica	Saúde	1	0	1	False	1	1	0	1	1	1	0	1	1	1	1	1	1	1	7	6	13
596e4d008c36c70a18c2cc92	SESAU	59cc4cbc8c36c773a84e2f7d	Vigilância Sanitária Fiscalização quanto à qualidade de medicamentos, alimentos, bens e serviços de interesse à saúde.	Saúde	1	0	1	False	1	1	0	1	1	1	0	1	1	0	1	1	1	1	7	5	12
596e4d008c36c70a18c2cc92	SESAU	59cc4f938c36c773a84e2f80	Vigilância Ambiental Prevenção e controle dos fatores de risco ambientais relacionados às doenças ou a outros agravos à saúde.	Saúde	1	0	1	False	1	1	1	1	1	1	0	0	1	0	0	1	1	1	6	5	11
596e4d008c36c70a18c2cc92	SESAU	59cc55e28c36c773a84e2f83	Cintilografia	Saúde	1	0	1	False	1	1	1	1	1	1	0	1	1	0	1	1	1	1	7	6	13
596e4d008c36c70a18c2cc92	SESAU	59cc57fc8c36c773a84e2f85	Consulta Médica de Pediatria	Saúde	1	0	1	False	1	1	0	1	1	1	1	1	1	1	1	1	1	1	8	6	14
596e4d008c36c70a18c2cc92	SESAU	59cc59db8c36c773a84e2f86	Consulta para o Diagnóstico do Câncer de Colo Uterino	Saúde	1	0	1	False	1	1	1	1	1	1	0	1	1	1	1	1	1	1	7	7	14
596e4d008c36c70a18c2cc92	SESAU	59cc5d828c36c773a84e2f88	Biopsia de Próstata	Saúde	1	0	1	False	1	1	0	1	1	1	0	1	1	1	1	1	1	1	7	6	13
596e4d008c36c70a18c2cc92	SESAU	59cc5f528c36c773a84e2f8a	Consulta em Angiologia	Saúde	1	0	1	False	1	1	0	1	1	1	0	1	1	1	1	1	1	1	7	6	13
596e4d008c36c70a18c2cc92	SESAU	59cc62788c36c773a84e2f8c	Consulta em Cardiologia Adulto	Saúde	1	0	1	False	1	1	0	0	1	1	1	1	1	1	1	1	1	1	7	6	13
596e4d008c36c70a18c2cc92	SESAU	59cc64108c36c773a84e2f8e	Consulta em Dermatologia	Saúde	1	0	1	False	1	1	0	1	1	1	1	1	1	1	1	1	1	1	8	6	14
596e4d008c36c70a18c2cc92	SESAU	59cc65b98c36c773a84e2f90	Consulta em Endocrinologia	Saúde	1	0	1	False	1	1	0	1	1	1	1	1	1	1	1	1	1	1	8	6	14
596e4d008c36c70a18c2cc92	SESAU	59cc66dc8c36c773a84e2f92	Consulta em Gastroenterologia Adulto	Saúde	1	0	1	False	1	1	0	1	1	1	1	1	1	1	1	1	1	1	8	6	14
596e4d008c36c70a18c2cc92	SESAU	59cc68208c36c773a84e2f94	Consulta em Geriatria	Saúde	1	0	1	False	1	1	0	1	1	1	1	1	1	1	1	1	1	1	8	6	14
596e4d008c36c70a18c2cc92	SESAU	59cc69348c36c773a84e2f96	Consulta em Nefrologia Pediátrica	Saúde	1	0	1	False	1	1	0	1	1	1	1	1	1	1	1	1	1	1	8	6	14
596e4d008c36c70a18c2cc92	SESAU	59cc6a758c36c773a84e2f98	Consulta em Neurologia Adulto	Saúde	1	0	1	False	1	1	0	1	1	1	1	1	1	1	1	1	1	1	8	6	14
596e4d008c36c70a18c2cc92	SESAU	59cc6b5e8c36c773a84e2f9a	Consulta em Oftalmologia	Saúde	1	0	1	False	1	1	0	1	1	1	1	1	1	1	1	1	1	1	8	6	14
